{"run":32,"commit":"ecae4f9","metric":1,"metrics":{"scanner_ms":5087},"status":"keep","description":"Add GIF MIME/data URL support for analyze_image","timestamp":1780135642435,"segment":13,"confidence":null,"asi":{"hypothesis":"Accepting GIF in analyze_image aligns HallucyGenie with MiniMax understand_image docs for JPEG/PNG/GIF/WebP support.","changed_files":["src/tools.ts","test/unit/tools.test.ts"],"remaining_failure":"analyze_image_gif_data_url scanner string expects an unescaped regex snippet while TypeScript source necessarily escapes slash in regex literal; code and unit test pass.","next_action_hint":"Fix scanner to use a real regex check rather than a brittle fixed-string for the data URL pattern."}}
{"run":33,"commit":"exp-fix","metric":1,"metrics":{"scanner_ms":5042},"status":"discard","description":"Tried to fix GIF data URL scanner fixed-string escape","timestamp":1780135687150,"segment":13,"confidence":null,"asi":{"hypothesis":"The remaining GIF failure is a scanner fixed-string mismatch, not app behavior; update the scanner needle to match the TypeScript regex literal.","rollback_reason":"Metric stayed at 1; the replacement still did not match the source literal.","next_action_hint":"Inspect `rg -n \"data:image\" src/tools.ts autoresearch.sh` and make the scanner use a robust grep/regex helper or exact observed source text."}}
{"run":34,"commit":"dca6add","metric":0,"metrics":{"scanner_ms":4976},"status":"keep","description":"Fix GIF data URL scanner escape after adding GIF support","timestamp":1780135731891,"segment":13,"confidence":null,"asi":{"hypothesis":"The GIF implementation was correct; the remaining contract failure was a scanner fixed-string with one extra backslash. Matching the actual TypeScript regex confirms GIF MIME, data URL validation, and unit test coverage all pass.","changed_files":["autoresearch.sh"],"code_already_kept":"ecae4f9 added GIF support in src/tools.ts and test/unit/tools.test.ts.","result":"contract_failures=0 with node agent/tools unit checks passing."}}
{"type":"config","name":"Latest MiniMax API contract compliance — web search response shapes","metricName":"contract_failures","metricUnit":"","bestDirection":"lower"}
{"run":35,"commit":"53ed116","metric":2,"metrics":{"scanner_ms":4961},"status":"keep","description":"Expanded scanner to require nested web search data.results parsing","timestamp":1780135826588,"segment":14,"confidence":null,"asi":{"hypothesis":"HallucyGenie should parse both observed MiniMax direct search shapes: organic[] with link and nested data.results[] with url, because existing E2E MiniMax mock uses data.results/url and direct endpoint shape is not public OpenAPI-stable.","benchmark_change":"Expanded contract scanner for nested data.results parser and unit test; reinitialized experiment.","baseline_failures":["web_search_nested_results_parser","web_search_url_result_test"],"anti_overfit_note":"This adds tolerant parsing for an observed internal-provider shape rather than changing tests to match current code."}}
{"run":36,"commit":"51bfad1","metric":0,"metrics":{"scanner_ms":5132},"status":"keep","description":"Parse nested data.results web search responses","timestamp":1780135891267,"segment":14,"confidence":null,"asi":{"hypothesis":"Tolerant web search parsing supports both `organic[].link` and observed `data.results[].url` provider/mock shapes without changing request semantics or consuming live quota.","changed_files":["src/tools.ts","test/unit/tools.test.ts"],"validation_behavior":"webSearch now normalizes results from `data.organic ?? data.data?.results ?? []`, mapping `link ?? url`, then keeps the existing 5-result cap and YouTube enrichment."}}
{"type":"config","name":"Latest MiniMax API contract compliance — analyze image GIF copy","metricName":"contract_failures","metricUnit":"","bestDirection":"lower"}
{"run":37,"commit":"1dedacf","metric":2,"metrics":{"scanner_ms":5277},"status":"keep","description":"Expanded scanner to require GIF in analyze_image user/model-facing copy","timestamp":1780135978306,"segment":15,"confidence":null,"asi":{"hypothesis":"After adding GIF support, tool schema descriptions and safe user error copy should mention GIF so the model/user do not incorrectly avoid supported GIF inputs.","benchmark_change":"Expanded scanner for analyze_image schema description and agent safe error message; reinitialized experiment.","baseline_failures":["analyze_image_schema_mentions_gif","analyze_image_error_mentions_gif"],"anti_overfit_note":"This follows actual behavior added in prior iteration and current MiniMax understand_image docs, not benchmark-only wording."}}
{"run":38,"commit":"7281210","metric":0,"metrics":{"scanner_ms":5102},"status":"keep","description":"Mention GIF in analyze_image schema and safe error copy","timestamp":1780136023254,"segment":15,"confidence":null,"asi":{"hypothesis":"User/model-facing copy should match implemented analyze_image GIF support and MiniMax docs, preventing agents from steering users away from valid GIF inputs.","changed_files":["src/tools.ts","src/agent.ts"],"result":"Tool schema and safe error message now list JPG, PNG, GIF, or WebP."}}
{"type":"config","name":"Latest MiniMax API contract compliance — web search empty organic fallback","metricName":"contract_failures","metricUnit":"","bestDirection":"lower"}
{"run":39,"commit":"20ee8bc","metric":2,"metrics":{"scanner_ms":5330},"status":"keep","description":"Expanded scanner to require nested search fallback when organic is empty","timestamp":1780136108719,"segment":16,"confidence":null,"asi":{"hypothesis":"MiniMax/internal search responses may include `organic: []` plus useful `data.results`; parser should treat empty organic as no results and fall back rather than stopping early.","benchmark_change":"Expanded contract scanner for empty-organic fallback code and unit test; reinitialized experiment.","baseline_failures":["web_search_empty_organic_fallback","web_search_empty_organic_fallback_test"],"anti_overfit_note":"This is tolerant response parsing for mixed observed shapes, not changing provider request or hiding failures."}}
{"run":40,"commit":"402506e","metric":1,"metrics":{"scanner_ms":5186},"status":"keep","description":"Add web search fallback test and non-empty organic logic","timestamp":1780136172642,"segment":16,"confidence":null,"asi":{"hypothesis":"Fallback logic should use nested data.results when organic is empty while preserving organic when non-empty.","changed_files":["src/tools.ts","test/unit/tools.test.ts"],"remaining_failure":"Scanner expected exact text `data.organic?.length ? data.organic : data.data?.results`; code has same logic but includes nullish fallback parentheses, so fixed-string check is too brittle.","next_action_hint":"Adjust scanner to search for `data.organic?.length ? data.organic` and keep unit test as behavior proof."}}
{"run":41,"commit":"96c8e67","metric":0,"metrics":{"scanner_ms":5332},"status":"keep","description":"Relax scanner for web search empty-organic fallback","timestamp":1780136210794,"segment":16,"confidence":null,"asi":{"hypothesis":"Implementation and unit behavior are correct; scanner should check the non-empty organic branch without requiring exact formatting of the nested fallback expression.","changed_files":["autoresearch.sh"],"code_already_kept":"402506e added fallback behavior and unit test.","result":"contract_failures=0 with node agent/tools checks passing."}}
{"type":"config","name":"Latest MiniMax API contract compliance — async TTS skill limits","metricName":"contract_failures","metricUnit":"","bestDirection":"lower"}
{"run":42,"commit":"3dfd71b","metric":2,"metrics":{"scanner_ms":5220},"status":"keep","description":"Expanded scanner to require latest async TTS limits in MiniMax skill","timestamp":1780136307773,"segment":17,"confidence":null,"asi":{"hypothesis":"Latest MiniMax async TTS docs distinguish direct `text` max 50,000 characters from `text_file_id` max 1,000,000; the project MiniMax skill should preserve that distinction for future agents.","benchmark_change":"Expanded scanner for factual skill cache lines; reinitialized experiment.","baseline_failures":["skill_async_tts_text_limit","skill_async_tts_file_limit"],"docs_basis":"speech-t2a-async-create.md: text max 50,000; text_file_id max 1,000,000."}}
{"run":43,"commit":"27a68b1","metric":1,"metrics":{"scanner_ms":5327},"status":"keep","description":"Update async TTS skill direct text/file limit wording","timestamp":1780136350416,"segment":17,"confidence":null,"asi":{"hypothesis":"Skill update should reflect latest async TTS direct text max 50,000 and text_file_id max 1,000,000.","changed_files":[".pi/skills/minimax/SKILL.md"],"remaining_failure":"Scanner expected exact phrase `text_file_id input max **1,000,000 characters**`; skill line includes backticks around text_file_id, so fixed-string check is too brittle.","next_action_hint":"Relax scanner to check `text_file_id` and `1,000,000 characters` separately or match the actual backticked phrase."}}
{"run":44,"commit":"bd35402","metric":0,"metrics":{"scanner_ms":5260},"status":"keep","description":"Match scanner to backticked text_file_id skill wording","timestamp":1780136385497,"segment":17,"confidence":null,"asi":{"hypothesis":"The async TTS skill content is now correct; scanner should match the actual Markdown wording with backticked `text_file_id`.","changed_files":["autoresearch.sh"],"code_already_kept":"27a68b1 updated .pi/skills/minimax/SKILL.md with direct text max 50,000 and text_file_id max 1,000,000.","result":"contract_failures=0 with node agent/tools checks passing."}}
{"type":"config","name":"Latest MiniMax API contract compliance — async TTS parameter names","metricName":"contract_failures","metricUnit":"","bestDirection":"lower"}
{"run":45,"commit":"ff06ce1","metric":2,"metrics":{"scanner_ms":5278},"status":"keep","description":"Expanded scanner to require latest async TTS parameter names in skill","timestamp":1780136532953,"segment":18,"confidence":null,"asi":{"hypothesis":"Latest MiniMax async TTS docs use `audio_setting.audio_sample_rate` and `voice_setting.english_normalization`; the project MiniMax skill should preserve these exact async names to prevent future implementation mistakes using sync names.","benchmark_change":"Expanded scanner for factual MiniMax skill cache; reinitialized experiment.","baseline_failures":["skill_async_tts_audio_sample_rate","skill_async_tts_english_normalization"],"docs_basis":"speech-t2a-async-create.md: T2AAsyncV2AudioSetting.audio_sample_rate and T2AAsyncV2VoiceSetting.english_normalization."}}
{"run":46,"commit":"aafcbd7","metric":1,"metrics":{"scanner_ms":5415},"status":"keep","description":"Add async TTS audio_sample_rate and english_normalization notes","timestamp":1780136571788,"segment":18,"confidence":null,"asi":{"hypothesis":"Skill should record async TTS parameter-name differences from sync TTS to prevent future wrong payloads.","changed_files":[".pi/skills/minimax/SKILL.md"],"remaining_failure":"Scanner expected exact backticked `english_normalization`, but skill text says `voice_setting.english_normalization`; content is correct, fixed-string too narrow.","next_action_hint":"Relax scanner to match `voice_setting.english_normalization` or `english_normalization` without backticks."}}
{"run":47,"commit":"74aee39","metric":0,"metrics":{"scanner_ms":5475},"status":"keep","description":"Match scanner to async TTS english_normalization wording","timestamp":1780136609402,"segment":18,"confidence":null,"asi":{"hypothesis":"Async TTS skill content is correct; scanner should match the documented full parameter path `voice_setting.english_normalization`.","changed_files":["autoresearch.sh"],"code_already_kept":"aafcbd7 updated .pi/skills/minimax/SKILL.md with async `audio_setting.audio_sample_rate` and `voice_setting.english_normalization`.","result":"contract_failures=0 with node agent/tools checks passing."}}
{"type":"config","name":"Latest MiniMax API contract compliance — async TTS interjection tags","metricName":"contract_failures","metricUnit":"","bestDirection":"lower"}
{"run":48,"commit":"6157216","metric":1,"metrics":{"scanner_ms":5557},"status":"keep","description":"Expanded scanner to require async TTS extra interjection tags in skill","timestamp":1780136701025,"segment":19,"confidence":null,"asi":{"hypothesis":"Latest async TTS docs add interjection tags `(whistles)`, `(crying)`, `(applause)` beyond the sync TTS list; the MiniMax skill should record this async-only distinction for future implementations.","benchmark_change":"Expanded scanner for factual MiniMax skill cache; reinitialized experiment.","baseline_failures":["skill_async_tts_extra_interjections"],"docs_basis":"speech-t2a-async-create.md lists `(whistles)`, `(crying)`, `(applause)` in async interjection tags."}}
{"run":49,"commit":"5498c1a","metric":0,"metrics":{"scanner_ms":5588},"status":"keep","description":"Add async TTS extra interjection tags to MiniMax skill","timestamp":1780136740405,"segment":19,"confidence":null,"asi":{"hypothesis":"Recording async-only interjection tags in the MiniMax skill keeps future async TTS implementation aligned with latest docs without changing runtime behavior.","changed_files":[".pi/skills/minimax/SKILL.md"],"result":"Skill now notes async extra interjection tags `(whistles)`, `(crying)`, `(applause)`; contract_failures=0."}}
{"type":"config","name":"Latest MiniMax API contract compliance — lyrics helper tags","metricName":"contract_failures","metricUnit":"","bestDirection":"lower"}
{"run":50,"commit":"4837730","metric":3,"metrics":{"scanner_ms":3847},"status":"keep","description":"Expanded scanner to require latest lyrics helper structure tags in MiniMax skill","timestamp":1780136826872,"segment":20,"confidence":null,"asi":{"hypothesis":"Latest lyrics_generation docs list helper output structure tags with hyphenated and additional forms (`[Pre-Chorus]`, `[Drop]`, `[Build-up]`, `[Instrumental]`, `[Breakdown]`) not captured in the MiniMax skill; future agents need the current list.","benchmark_change":"Expanded scanner for factual MiniMax skill cache; reinitialized experiment.","baseline_failures":["skill_lyrics_helper_tags","skill_lyrics_helper_drop_tag","skill_lyrics_helper_instrumental_tag"],"docs_basis":"lyrics-generation.md supported structure tags (14 types)."}}
{"run":51,"commit":"730d77f","metric":0,"metrics":{"scanner_ms":3969},"status":"keep","description":"Add latest lyrics helper structure tags to MiniMax skill","timestamp":1780136887091,"segment":20,"confidence":null,"asi":{"hypothesis":"Recording the current lyrics_generation output tag list in the MiniMax skill prevents future agents from assuming only music-generation lyric tags are valid.","changed_files":[".pi/skills/minimax/SKILL.md"],"result":"Skill now distinguishes music generation lyric tags from lyrics helper output tags including `[Pre-Chorus]`, `[Drop]`, `[Build-up]`, `[Instrumental]`, and `[Breakdown]`."}}
{"type":"config","name":"Latest MiniMax API contract compliance — get voice request contract","metricName":"contract_failures","metricUnit":"","bestDirection":"lower"}
{"run":52,"commit":"ec8c767","metric":2,"metrics":{"scanner_ms":4183},"status":"keep","description":"Expanded scanner to require Get Voice request contract in MiniMax skill","timestamp":1780136973137,"segment":21,"confidence":null,"asi":{"hypothesis":"Latest MiniMax Get Voice docs require a `voice_type` request parameter with values `all`, `system`, `voice_cloning`, or `voice_generation`; the MiniMax skill should record this to prevent future callers from sending an empty body.","benchmark_change":"Expanded scanner for factual MiniMax skill cache; reinitialized experiment.","baseline_failures":["skill_get_voice_requires_voice_type","skill_get_voice_all_type"],"docs_basis":"voice-management-get.md GetVoiceReq requires `voice_type`; supported values all/system/voice_cloning/voice_generation."}}
{"run":53,"commit":"c5e5c4e","metric":0,"metrics":{"scanner_ms":4174},"status":"keep","description":"Add Get Voice voice_type contract to MiniMax skill","timestamp":1780137006651,"segment":21,"confidence":null,"asi":{"hypothesis":"Recording `voice_type` and allowed values in the MiniMax skill preserves the latest Get Voice request contract for future non-quota implementations/manual smoke docs.","changed_files":[".pi/skills/minimax/SKILL.md"],"result":"Skill now says Get voice requires `voice_type`; values `all|system|voice_cloning|voice_generation`."}}
{"type":"config","name":"Latest MiniMax API contract compliance — video agent template examples","metricName":"contract_failures","metricUnit":"","bestDirection":"lower"}
{"run":54,"commit":"7ed1b2e","metric":2,"metrics":{"scanner_ms":4398},"status":"keep","description":"Expanded scanner to require latest Video Agent template examples in MiniMax skill","timestamp":1780137105210,"segment":22,"confidence":null,"asi":{"hypothesis":"Latest MiniMax API overview lists concrete Video Agent template IDs and required inputs; recording a couple of examples in the skill helps future agents avoid vague 'docs list templates' guidance without adding app video support or using quota.","benchmark_change":"Expanded scanner for factual MiniMax skill cache; reinitialized experiment.","baseline_failures":["skill_video_agent_diving_template","skill_video_agent_run_template"],"docs_basis":"api-overview.md Video Agent template list includes 392747428568649728 Diving and 393769180141805569 Run for Life."}}
{"run":55,"commit":"45aa435","metric":0,"metrics":{"scanner_ms":5811},"status":"keep","description":"Add Video Agent template examples to MiniMax skill","timestamp":1780137145368,"segment":22,"confidence":null,"asi":{"hypothesis":"Adding concrete Video Agent template IDs and input requirements to the MiniMax skill improves future API accuracy while keeping current app scope unchanged and avoiding quota use.","changed_files":[".pi/skills/minimax/SKILL.md"],"result":"Skill now lists `392747428568649728` Diving and `393769180141805569` Run for Life examples with required inputs."}}
{"type":"config","name":"Latest MiniMax API contract compliance — file upload purposes","metricName":"contract_failures","metricUnit":"","bestDirection":"lower"}
{"run":56,"commit":"f15c72f","metric":2,"metrics":{"scanner_ms":5088},"status":"keep","description":"Expanded scanner to require latest file upload purposes in MiniMax skill","timestamp":1780137260755,"segment":23,"confidence":null,"asi":{"hypothesis":"Latest MiniMax file upload docs define upload `purpose` values `voice_clone`, `prompt_audio`, and `t2a_async_input`; the MiniMax skill currently has generic/outdated file format notes and should record the purpose contract for future upload implementations.","benchmark_change":"Expanded scanner for factual MiniMax skill cache; reinitialized experiment.","baseline_failures":["skill_file_upload_purposes","skill_file_upload_t2a_async_input"],"docs_basis":"file-management-upload.md multipart form requires purpose and file; purpose enum voice_clone/prompt_audio/t2a_async_input."}}
{"run":57,"commit":"440ef49","metric":0,"metrics":{"scanner_ms":5997},"status":"keep","description":"Add file upload purpose contract to MiniMax skill","timestamp":1780137297242,"segment":23,"confidence":null,"asi":{"hypothesis":"Recording MiniMax upload purposes and per-purpose formats in the skill prevents future upload code from using stale generic document/audio format assumptions.","changed_files":[".pi/skills/minimax/SKILL.md"],"result":"Skill now lists upload `purpose` values `voice_clone|prompt_audio|t2a_async_input` and notes `t2a_async_input` text file for async long TTS."}}
{"type":"config","name":"Latest MiniMax API contract compliance — file retrieve endpoint split","metricName":"contract_failures","metricUnit":"","bestDirection":"lower"}
{"run":58,"commit":"425e6cc","metric":2,"metrics":{"scanner_ms":6412},"status":"keep","description":"Expanded scanner to require MiniMax file retrieve endpoint split in skill","timestamp":1780137389335,"segment":24,"confidence":null,"asi":{"hypothesis":"Latest MiniMax file management docs distinguish `/v1/files/retrieve` metadata/download_url from `/v1/files/retrieve_content` raw file bytes; recording the split prevents future download code from treating both endpoints as interchangeable.","benchmark_change":"Expanded scanner for factual MiniMax skill cache; reinitialized experiment.","baseline_failures":["skill_file_retrieve_metadata","skill_file_retrieve_content_bytes"],"docs_basis":"file-management-retrieve.md GET /v1/files/retrieve requires query file_id and returns FileObject with download_url; file-management-retrieve-content.md GET /v1/files/retrieve_content requires query file_id and returns binary content."}}
{"run":59,"commit":"b1b53bf","metric":0,"metrics":{"scanner_ms":6534},"status":"keep","description":"Add file retrieve endpoint split to MiniMax skill","timestamp":1780137416388,"segment":24,"confidence":null,"asi":{"hypothesis":"Documenting the MiniMax file retrieve/retrieve_content split in the project skill preserves current download semantics for future implementations without changing runtime behavior or using quota.","changed_files":[".pi/skills/minimax/SKILL.md"],"result":"Skill now states `GET /v1/files/retrieve` requires query `file_id` and returns metadata plus `download_url`; `GET /v1/files/retrieve_content` requires query `file_id` and returns raw file bytes."}}
{"type":"config","name":"Latest MiniMax API contract compliance — file list delete requirements","metricName":"contract_failures","metricUnit":"","bestDirection":"lower"}
