{"run":60,"commit":"ac86f2b","metric":2,"metrics":{"scanner_ms":6496},"status":"keep","description":"Expanded scanner to require MiniMax file list/delete request contracts in skill","timestamp":1780137494609,"segment":25,"confidence":null,"asi":{"hypothesis":"Latest MiniMax file management docs require `/v1/files/list` query `purpose` and `/v1/files/delete` JSON `file_id` plus `purpose`; recording these contracts prevents future file cleanup/list code from sending under-specified requests.","benchmark_change":"Expanded scanner for factual MiniMax skill cache; reinitialized experiment.","baseline_failures":["skill_file_list_requires_purpose","skill_file_delete_requires_json"],"docs_basis":"file-management-list.md GET /v1/files/list has required query purpose; file-management-delete.md POST /v1/files/delete has required JSON file_id and purpose."}}
{"run":61,"commit":"3ebdb6e","metric":0,"metrics":{"scanner_ms":6660},"status":"keep","description":"Add file list/delete request contracts to MiniMax skill","timestamp":1780137521970,"segment":25,"confidence":null,"asi":{"hypothesis":"Documenting file list/delete required parameters in the MiniMax skill preserves current request semantics for future upload/file-management implementations without runtime changes or live quota use.","changed_files":[".pi/skills/minimax/SKILL.md"],"result":"Skill now states `GET /v1/files/list` requires query `purpose`; `POST /v1/files/delete` requires JSON `file_id` plus `purpose`."}}
{"type":"config","name":"Latest MiniMax API contract compliance — file delete purpose values","metricName":"contract_failures","metricUnit":"","bestDirection":"lower"}
{"run":62,"commit":"f570bfd","metric":1,"metrics":{"scanner_ms":6737},"status":"keep","description":"Expanded scanner to require MiniMax file delete purpose enum in skill","timestamp":1780137602103,"segment":26,"confidence":null,"asi":{"hypothesis":"MiniMax file delete accepts a wider purpose enum than upload/list, including `t2a_async` and `video_generation`; recording the delete-specific enum prevents future cleanup code from rejecting/deleting generated async outputs incorrectly.","benchmark_change":"Expanded scanner for factual MiniMax skill cache; reinitialized experiment.","baseline_failures":["skill_file_delete_purpose_values"],"docs_basis":"file-management-delete.md DeleteFileReq requires file_id and purpose; purpose enum voice_clone, prompt_audio, t2a_async, t2a_async_input, video_generation."}}
{"run":63,"commit":"db059a1","metric":0,"metrics":{"scanner_ms":6503},"status":"keep","description":"Add file delete purpose enum to MiniMax skill","timestamp":1780137629716,"segment":26,"confidence":null,"asi":{"hypothesis":"Documenting delete-specific purpose values in the MiniMax skill preserves the latest file cleanup contract and avoids conflating upload/list purpose enums with delete purpose enum.","changed_files":[".pi/skills/minimax/SKILL.md"],"result":"Skill now states Delete `purpose` values: `voice_clone|prompt_audio|t2a_async|t2a_async_input|video_generation`."}}
{"type":"config","name":"Latest MiniMax API contract compliance — t2a_async_input upload formats","metricName":"contract_failures","metricUnit":"","bestDirection":"lower"}
{"run":64,"commit":"75d3c39","metric":1,"metrics":{"scanner_ms":6510},"status":"keep","description":"Expanded scanner to require t2a_async_input upload/list formats in MiniMax skill","timestamp":1780137710586,"segment":27,"confidence":null,"asi":{"hypothesis":"Latest MiniMax file list docs and async TTS docs say `t2a_async_input` supports `txt` and `zip`; the skill currently says only text file, which can mislead future async long TTS upload code.","benchmark_change":"Expanded scanner for factual MiniMax skill cache; reinitialized experiment.","baseline_failures":["skill_file_upload_t2a_formats"],"docs_basis":"file-management-list.md says t2a_async_input supports txt, zip formats; async TTS skill/docs already note `text_file_id` supports txt, zip."}}
{"run":65,"commit":"exp-t2a","metric":1,"metrics":{"scanner_ms":6528},"status":"discard","description":"Tried to replace t2a_async_input text-file wording with txt|zip wording","timestamp":1780137749597,"segment":27,"confidence":null,"asi":{"hypothesis":"Changing the file-management upload format line to `t2a_async_input` supports `txt|zip` should satisfy latest docs, but it removed the older required text-file contract phrase still tracked by the scanner.","rollback_reason":"Primary metric stayed at 1 because `skill_file_upload_t2a_async_input` failed after the wording replacement.","next_action_hint":"Preserve both facts in one skill line: `t2a_async_input` text file for async long TTS and `t2a_async_input` supports `txt|zip` for async long TTS.","failure":"FAIL skill_file_upload_t2a_async_input"}}
