{"type":"config","name":"Latest MiniMax API contract compliance","metricName":"contract_failures","metricUnit":"","bestDirection":"lower"}
{"run":1,"commit":"baselin","metric":5,"metrics":{"scanner_ms":580},"status":"checks_failed","description":"Baseline latest MiniMax API contract scanner before code changes; checks script temp path failed","timestamp":1780133978615,"segment":0,"confidence":null,"asi":{"hypothesis":"Initial scanner quantifies MiniMax doc/code gaps without live quota use.","rollback_reason":"Correctness checks failed because autoresearch.checks.sh tried writing /tmp/hallucygenie-typecheck.log and Termux denied it, not because app code failed.","next_action_hint":"Change checks log path to repo-local .autoresearch-tmp or mktemp, then rerun baseline."}}
{"run":2,"commit":"baselin","metric":5,"metrics":{"scanner_ms":622},"status":"checks_failed","description":"Baseline rerun after repo-local check logs; environment lacks bunx","timestamp":1780134002918,"segment":0,"confidence":null,"asi":{"hypothesis":"Baseline contract gaps remain 5; correctness checks should verify app types/tests.","rollback_reason":"Checks failed because this Termux PATH has no bunx/bun, while justfile typecheck recipe calls bunx.","next_action_hint":"Use local node_modules/.bin/tsc for autoresearch.checks.sh in this environment; do not treat as app code failure."}}
{"run":3,"commit":"baselin","metric":5,"metrics":{"scanner_ms":671},"status":"checks_failed","description":"Baseline with tsc fallback; dependencies incomplete","timestamp":1780134029732,"segment":0,"confidence":null,"asi":{"hypothesis":"Use available TypeScript compiler to verify correctness when bun/bunx are absent.","rollback_reason":"Checks failed because node_modules lacks @types/bun; dependency installation incomplete.","next_action_hint":"Install dependencies or adjust environment before measuring code changes; do not modify app code until baseline checks pass."}}
{"run":4,"commit":"2b70197","metric":5,"metrics":{"scanner_ms":759},"status":"keep","description":"Baseline latest MiniMax API contract gaps with working checks","timestamp":1780134066437,"segment":0,"confidence":null,"asi":{"hypothesis":"Contract scanner baseline should expose implicit provider defaults before code changes.","dependency_note":"npm install failed in prepare because lefthook android binary missing, but dependencies were installed enough for @types/bun and tsc checks.","baseline_failures":["image_response_format_explicit","tts_output_format_explicit","tts_audio_format_explicit","music_output_formats_explicit","music_audio_formats_explicit"]}}
{"run":5,"commit":"eb20b15","metric":0,"metrics":{"scanner_ms":538},"status":"keep","description":"Set explicit MiniMax media response/audio formats to match parser assumptions","timestamp":1780134094574,"segment":0,"confidence":null,"asi":{"hypothesis":"Explicit image response_format=url and audio output_format=hex/audio_setting.format=mp3 remove reliance on provider defaults while preserving existing behavior.","changed_files":["src/tools.ts"],"latest_docs_basis":["image_generation response_format supports url/base64 default url","t2a_v2 output_format supports hex/url default hex; audio_setting.format supports mp3","music_generation output_format supports hex/url default hex; audio_setting.format supports mp3"]}}
{"type":"config","name":"Latest MiniMax API contract compliance — schema limits","metricName":"contract_failures","metricUnit":"","bestDirection":"lower"}
{"run":6,"commit":"b979c32","metric":6,"metrics":{"scanner_ms":825},"status":"keep","description":"Expanded latest MiniMax scanner to include provider maxLength schema contracts","timestamp":1780134156912,"segment":1,"confidence":null,"asi":{"hypothesis":"Anthropic tool schemas should advertise MiniMax provider maxLength limits for image, TTS, music, and lyrics so tool calls stay inside documented bounds.","benchmark_change":"Expanded contract scanner; reinitialized experiment because primary workload changed.","baseline_failures":["image_prompt_schema_limit","tts_text_schema_limit","music_prompt_schema_limit","music_lyrics_schema_limit","lyrics_prompt_schema_limit","lyrics_existing_schema_limit"]}}
{"run":7,"commit":"99d3672","metric":0,"metrics":{"scanner_ms":706},"status":"keep","description":"Add MiniMax provider maxLength limits to tool schemas","timestamp":1780134178314,"segment":1,"confidence":null,"asi":{"hypothesis":"Adding documented maxLength values to Anthropic tool schemas helps the model avoid invalid MiniMax requests without exposing extra provider complexity.","changed_files":["src/tools.ts"],"limits":{"image_prompt":1500,"tts_text":10000,"music_prompt":2000,"music_lyrics":3500,"lyrics_prompt":2000,"lyrics_existing":3500}}}
{"type":"config","name":"Latest MiniMax API contract compliance — runtime bounds","metricName":"contract_failures","metricUnit":"","bestDirection":"lower"}
{"run":8,"commit":"9e4c991","metric":7,"metrics":{"scanner_ms":864},"status":"keep","description":"Expanded scanner to require runtime bounds before MiniMax calls","timestamp":1780134225754,"segment":2,"confidence":null,"asi":{"hypothesis":"Schema maxLength is advisory; direct tool execution should validate bounds before sending invalid/expensive MiniMax requests.","benchmark_change":"Expanded contract scanner for runtime max constants and bounded text validator; reinitialized experiment.","baseline_failures":["image_prompt_runtime_limit","tts_text_runtime_limit","music_prompt_runtime_limit","music_lyrics_runtime_limit","lyrics_prompt_runtime_limit","lyrics_existing_runtime_limit","bounded_text_validator"]}}
{"run":9,"commit":"e63b98a","metric":0,"metrics":{"scanner_ms":1626},"status":"keep","description":"Validate MiniMax text bounds before provider calls","timestamp":1780134287488,"segment":2,"confidence":null,"asi":{"hypothesis":"Shared max constants plus bounded text validation prevent invalid over-limit MiniMax calls from direct tool execution and avoid quota-consuming provider errors.","changed_files":["src/tools.ts"],"validation_behavior":"Required strings are trimmed and rejected if missing or above documented max; optional lyrics trim empty to undefined and reject over max."}}
{"type":"config","name":"Latest MiniMax API contract compliance — official chat auth header","metricName":"contract_failures","metricUnit":"","bestDirection":"lower"}
{"run":10,"commit":"7babe98","metric":1,"metrics":{"scanner_ms":1537},"status":"keep","description":"Expanded scanner to require official X-Api-Key header spelling","timestamp":1780134329050,"segment":3,"confidence":null,"asi":{"hypothesis":"Latest Anthropic-compatible docs name the chat auth header X-Api-Key; matching spelling reduces proxy/client ambiguity while preserving auth semantics.","benchmark_change":"Expanded scanner for chat auth header spelling; reinitialized experiment.","baseline_failures":["chat_auth_header_official"]}}
{"run":11,"commit":"4cadb2e","metric":0,"metrics":{"scanner_ms":1595},"status":"keep","description":"Use official X-Api-Key header spelling for Anthropic-compatible chat","timestamp":1780134356306,"segment":3,"confidence":null,"asi":{"hypothesis":"Changing the chat request header from lowercase x-api-key to X-Api-Key aligns with current docs without changing HTTP semantics; tests updated to assert official spelling.","changed_files":["src/agent.ts","test/unit/agent.test.ts"],"compatibility_note":"HTTP headers are case-insensitive; this is docs-alignment, not a credential behavior change."}}
{"type":"config","name":"Latest MiniMax API contract compliance — skill cache freshness","metricName":"contract_failures","metricUnit":"","bestDirection":"lower"}
{"run":12,"commit":"41dec3a","metric":2,"metrics":{"scanner_ms":1639},"status":"keep","description":"Expanded scanner to require MiniMax skill freshness and prompt caching note","timestamp":1780134390995,"segment":4,"confidence":null,"asi":{"hypothesis":"Latest API work should update the project MiniMax skill cache so future agents preserve factual docs changes, especially explicit cache_control support.","benchmark_change":"Expanded scanner for .pi/skills/minimax/SKILL.md crawl date and cache_control mention; reinitialized experiment.","baseline_failures":["skill_docs_date","skill_prompt_caching"]}}
{"run":13,"commit":"3875018","metric":0,"metrics":{"scanner_ms":1615},"status":"keep","description":"Refresh MiniMax skill crawl date and prompt caching guidance","timestamp":1780134417336,"segment":4,"confidence":null,"asi":{"hypothesis":"Updating the MiniMax skill with the 2026-05-30 crawl date and cache_control guidance preserves latest API knowledge for future agents without changing runtime behavior.","changed_files":[".pi/skills/minimax/SKILL.md"],"docs_basis":["anthropic-api-compatible-cache.md","text-chat-anthropic.md"]}}
{"type":"config","name":"Latest MiniMax API contract compliance — cache breakpoints","metricName":"contract_failures","metricUnit":"","bestDirection":"lower"}
{"run":14,"commit":"92099a8","metric":1,"metrics":{"scanner_ms":1648},"status":"keep","description":"Expanded scanner to enforce single system cache breakpoint","timestamp":1780134456636,"segment":5,"confidence":null,"asi":{"hypothesis":"MiniMax prompt caching supports up to 4 active cache_control breakpoints; adding cache_control to every system block risks wasting breakpoints if multiple system messages exist.","benchmark_change":"Expanded scanner for system cache breakpoint placement; reinitialized experiment.","baseline_failures":["chat_single_system_cache_breakpoint"]}}
{"run":15,"commit":"92edafa","metric":0,"metrics":{"scanner_ms":1699},"status":"keep","description":"Cache only final system block for MiniMax prompt caching","timestamp":1780134488236,"segment":5,"confidence":null,"asi":{"hypothesis":"Moving system cache_control to the final system block preserves system caching while avoiding one cache breakpoint per system message.","changed_files":["src/agent.ts"],"prompt_caching_note":"Tools still cache only the last tool definition; system now contributes at most one cache_control breakpoint."}}
{"type":"config","name":"Latest MiniMax API contract compliance — cache tests","metricName":"contract_failures","metricUnit":"","bestDirection":"lower"}
{"run":16,"commit":"baec115","metric":1,"metrics":{"scanner_ms":1633},"status":"keep","description":"Expanded scanner to require cache breakpoint unit contract","timestamp":1780134536413,"segment":6,"confidence":null,"asi":{"hypothesis":"Runtime cache breakpoint behavior should have a unit contract so future edits do not re-add cache_control to every system block.","benchmark_change":"Expanded scanner for agent test coverage; reinitialized experiment.","baseline_failures":["chat_single_system_cache_test"]}}
{"run":17,"commit":"97da34d","metric":0,"metrics":{"scanner_ms":1802},"status":"keep","description":"Add unit contract for final-system-block prompt caching","timestamp":1780134566314,"segment":6,"confidence":null,"asi":{"hypothesis":"A direct toAnthropicPayload test protects the MiniMax prompt caching invariant: only the final system block receives cache_control.","changed_files":["test/unit/agent.test.ts"],"test_note":"Environment checks run TypeScript only because bun/bunx are unavailable; test added for normal project test runner."}}
{"type":"config","name":"Latest MiniMax API contract compliance — media format tests","metricName":"contract_failures","metricUnit":"","bestDirection":"lower"}
{"run":18,"commit":"7868ef6","metric":5,"metrics":{"scanner_ms":1697},"status":"keep","description":"Expanded scanner to require tests for explicit media format payloads","timestamp":1780134623688,"segment":7,"confidence":null,"asi":{"hypothesis":"After making MiniMax media formats explicit, unit tests must assert those fields instead of treating them as forbidden extras.","benchmark_change":"Expanded scanner for tools.test.ts media payload assertions; reinitialized experiment.","baseline_failures":["image_response_format_test","tts_output_format_test","tts_audio_format_test","music_output_format_test","music_audio_format_test"]}}
{"run":19,"commit":"fce50eb","metric":0,"metrics":{"scanner_ms":1603},"status":"keep","description":"Update tool tests for explicit MiniMax media format payloads","timestamp":1780134660206,"segment":7,"confidence":null,"asi":{"hypothesis":"Tests should now assert explicit response_format/output_format/audio_setting payloads so future changes do not reintroduce provider-default reliance.","changed_files":["test/unit/tools.test.ts"],"test_updates":["image response_format=url","TTS output_format=hex and audio_setting.format=mp3","music and music-cover output_format=hex and audio_setting.format=mp3"]}}
{"type":"config","name":"Latest MiniMax API contract compliance — runtime bounds tests","metricName":"contract_failures","metricUnit":"","bestDirection":"lower"}
{"run":20,"commit":"f6ab612","metric":1,"metrics":{"scanner_ms":1490},"status":"keep","description":"Expanded scanner to require runtime bounds unit test","timestamp":1780134699053,"segment":8,"confidence":null,"asi":{"hypothesis":"Runtime max-length validation should be covered by a test that proves invalid input returns local errors and avoids fetch/provider quota use.","benchmark_change":"Expanded scanner for bounded text unit test; reinitialized experiment.","baseline_failures":["bounded_text_test"]}}
{"run":21,"commit":"d3a8e9e","metric":0,"metrics":{"scanner_ms":1592},"status":"keep","description":"Add test proving over-limit MiniMax text avoids fetch","timestamp":1780134731804,"segment":8,"confidence":null,"asi":{"hypothesis":"A local over-limit test protects quota by ensuring invalid image/TTS/lyrics/music text fails before any MiniMax fetch.","changed_files":["test/unit/tools.test.ts"],"test_note":"Covers image prompt >1500, TTS text >10000, lyrics prompt >2000, music prompt >2000."}}
{"type":"config","name":"Latest MiniMax API contract compliance — node unit tests","metricName":"contract_failures","metricUnit":"","bestDirection":"lower"}
{"run":22,"commit":"e1db98e","metric":1,"metrics":{"scanner_ms":3363},"status":"keep","description":"Expanded scanner to include Node agent/tools unit tests","timestamp":1780134866837,"segment":9,"confidence":null,"asi":{"hypothesis":"Contract scanner should include real offline unit tests so MiniMax payload/parser regressions are caught, not only static string checks.","benchmark_change":"Expanded benchmark with node --test test/unit/agent.test.ts test/unit/tools.test.ts; reinitialized experiment.","baseline_failure":"node_agent_tools_unit fails because agent tests used invalid JSON fixtures that old permissive tool validation hid."}}
{"run":23,"commit":"112af22","metric":0,"metrics":{"scanner_ms":3185},"status":"keep","description":"Fix agent unit fixtures to use valid streamed tool JSON","timestamp":1780134894830,"segment":9,"confidence":null,"asi":{"hypothesis":"Runtime bounds are correct; the failing unit tests relied on malformed streamed JSON that previously fell through to empty args and still hit mocked providers. Fix fixtures to represent valid Anthropic input_json_delta payloads.","changed_files":["test/unit/agent.test.ts"],"fixes":["input_json_delta chunks now concatenate to {\"prompt\":\"a cat\"}","generate_music fixture uses JSON.stringify so lyrics newline is escaped"]}}
{"type":"config","name":"Latest MiniMax API contract compliance — music cover bounds","metricName":"contract_failures","metricUnit":"","bestDirection":"lower"}
{"run":24,"commit":"d29d74d","metric":5,"metrics":{"scanner_ms":3355},"status":"keep","description":"Expanded scanner to require MiniMax music-cover text bounds","timestamp":1780134991589,"segment":10,"confidence":null,"asi":{"hypothesis":"Music-cover two-step generation has stricter documented bounds than normal music; validate prompt 10-300 and lyrics 10-1000 locally before provider calls to avoid invalid quota-consuming requests.","benchmark_change":"Expanded contract scanner for MUSIC_COVER_* constants and a unit test proving invalid cover text avoids fetch; reinitialized experiment.","baseline_failures":["music_cover_prompt_min","music_cover_prompt_max","music_cover_lyrics_min","music_cover_lyrics_max","music_cover_bounds_test"]}}
{"run":25,"commit":"fb991db","metric":1,"metrics":{"scanner_ms":3506},"status":"keep","description":"Add music-cover text bounds and invalid-input test","timestamp":1780135078920,"segment":10,"confidence":null,"asi":{"hypothesis":"Local music-cover prompt/lyrics range validation should eliminate most documented provider-bound gaps and avoid invalid MiniMax calls.","changed_files":["src/tools.ts","test/unit/tools.test.ts"],"remaining_failure":"node_agent_tools_unit: existing music cover network-failure test uses prompt 'spooky' below new documented 10-char minimum, so it now fails before mocked fetch.","next_action_hint":"Update existing music cover error-path fixtures to use documented-valid prompt/lyrics lengths, then rerun."}}
{"run":26,"commit":"f7afcba","metric":0,"metrics":{"scanner_ms":4046},"status":"keep","description":"Update music-cover fixtures to satisfy documented text ranges","timestamp":1780135180254,"segment":10,"confidence":null,"asi":{"hypothesis":"Remaining failure is test data, not runtime logic: music-cover error-path and dispatch tests should use provider-valid prompt/lyrics lengths so they exercise fetch/API behavior after local validation.","changed_files":["test/unit/tools.test.ts"],"fixes":["Changed existing music-cover prompt fixtures from 'spooky' to 'spooky boss'.","Changed executeTool generate_music_cover lyrics from 'la' to 'valid lyric'."],"result":"All music-cover range checks and node agent/tools unit tests now pass."}}
{"type":"config","name":"Latest MiniMax API contract compliance — cover preprocess source exclusivity","metricName":"contract_failures","metricUnit":"","bestDirection":"lower"}
{"run":27,"commit":"f243b09","metric":2,"metrics":{"scanner_ms":3579},"status":"keep","description":"Expanded scanner to require music-cover preprocess source exclusivity","timestamp":1780135263434,"segment":11,"confidence":null,"asi":{"hypothesis":"MiniMax cover preprocess docs require exactly one of audio_url or audio_base64. Local validation should reject both sources before provider calls to avoid invalid requests and protect quota.","benchmark_change":"Expanded contract scanner for source exclusivity code and test; reinitialized experiment.","baseline_failures":["music_cover_preprocess_exclusive","music_cover_preprocess_exclusive_test"],"docs_basis":"music-cover-preprocess.md: Exactly one of audio_url or audio_base64 must be provided."}}
{"run":28,"commit":"abafb97","metric":0,"metrics":{"scanner_ms":3731},"status":"keep","description":"Reject music-cover preprocess with both audio sources","timestamp":1780135307534,"segment":11,"confidence":null,"asi":{"hypothesis":"Enforcing audio_url XOR audio_base64 locally matches MiniMax cover preprocess docs and prevents invalid provider calls before quota/network use.","changed_files":["src/tools.ts","test/unit/tools.test.ts"],"validation_behavior":"musicCoverPreprocess now throws when both audio_url and audio_base64 are supplied; unit test proves fetch is not called."}}
{"type":"config","name":"Latest MiniMax API contract compliance — cover preprocess response shape","metricName":"contract_failures","metricUnit":"","bestDirection":"lower"}
{"run":29,"commit":"c74bdc7","metric":2,"metrics":{"scanner_ms":5116},"status":"keep","description":"Expanded scanner to require documented top-level cover preprocess response parsing","timestamp":1780135407581,"segment":12,"confidence":null,"asi":{"hypothesis":"Latest MiniMax music-cover preprocess docs show cover_feature_id and formatted_lyrics at response top level, while current code only reads data.cover_feature_id; support documented shape to prevent false missing-id errors.","benchmark_change":"Expanded scanner for top-level cover preprocess response parser and unit test; reinitialized experiment.","baseline_failures":["music_cover_preprocess_top_level","music_cover_preprocess_top_level_test"],"docs_basis":"music-cover-preprocess.md CoverPreprocessResp properties include top-level cover_feature_id and formatted_lyrics."}}
{"run":30,"commit":"e9c390d","metric":0,"metrics":{"scanner_ms":4867},"status":"keep","description":"Parse documented top-level music-cover preprocess response","timestamp":1780135474160,"segment":12,"confidence":null,"asi":{"hypothesis":"MiniMax cover preprocess can return documented top-level cover_feature_id/formatted_lyrics; parsing data.data ?? data prevents false missing-id errors while preserving current offline mocks.","changed_files":["src/tools.ts","test/unit/tools.test.ts"],"validation_behavior":"musicCoverPreprocess now reads cover_feature_id/formatted_lyrics/lyrics from nested data when present, otherwise from the top-level response.","docs_basis":"music-cover-preprocess.md CoverPreprocessResp top-level properties."}}
{"type":"config","name":"Latest MiniMax API contract compliance — analyze image GIF support","metricName":"contract_failures","metricUnit":"","bestDirection":"lower"}
{"run":31,"commit":"a3ea3b3","metric":3,"metrics":{"scanner_ms":4955},"status":"keep","description":"Expanded scanner to require GIF support for analyze_image","timestamp":1780135579433,"segment":13,"confidence":null,"asi":{"hypothesis":"Latest MiniMax Token Plan MCP understand_image docs support JPEG, PNG, GIF, and WebP up to 20MB; HallucyGenie analyze_image should accept GIF URLs/data URLs instead of rejecting them locally.","benchmark_change":"Expanded contract scanner for GIF docs, MIME handling, data URL validation, and a unit test; reinitialized experiment.","baseline_failures":["analyze_image_gif_mime","analyze_image_gif_data_url","analyze_image_gif_test"],"docs_basis":"token-plan/mcp-guide.md Supported formats: JPEG, PNG, GIF, WebP (max 20MB)."}}
